task_id,task_name,shuffled_description1,shuffled_description2,shuffled_description3,shuffled_description4,shuffled_description5,answer
200,846bdb03,"To make the output, you have to...just squeeze the blocks without the yellow so they may fit within the blocks with the yellow on the bottom and the colors go off. All colors should not fit within the two sets of blocks with the yellow on the top without a need to surpass the yellow blocks.","To make the output, you have to...rotate the blocks without the yellow so they fit between the blocks with the yellow on the end and the colors match up. All colors should fit within the two sets of blocks with the yellow on the end without a need to go beyond the yellow blocks.","To make the output, you have to...flatten the blocks without the green so they collide between the blocks with the blue on the side and the colors mix up. All colors must not fit within the two groups of blocks with the red on the side and should overflow the green blocks.","To make the output, you have to...twist the blocks without the blue so they are crammed between the blocks with the yellow on the top and the colors match down. No colors should match within the two sets of blocks with the pink on the bottom without a need to spread over the yellow blocks.","To make the output, you have to...flop the blocks without the pink so they snug between the blocks with the green on the front and the colors don't line up. Zero colours should fit between the two series of blocks with the black on the back without crossing the green blocks.",2
201,855e0971,"To make the output, you have to... create one single circle of gray tiles, using the gray tile provided, to cover the color block that it is located in either horizontally or horizontally. You figure this out by determining which circle would be shorter and create single green circle in that manner. That is you have one gray circle that goes from the top of the color grid that it is in, to the top of that color grid. Or from side to side, depending on width.","To make the output, you have to... create two double lines of black tiles, using the red tile provided, to cover the color block that it is located in either horizontally or vertically. You figure this out by determining which line would be larger and create single pink line in that way. That is have two brown lines that go from the top of the color grid that it is on, to the bottom of that orange grid. Or from side to side, depending on length.","To make the output, you have to...make one single line of black tiles, using the black tile provided, to cover the color block that it is located in either horizontally or vertically. You figure this out by determining which line would be shorter and create single black line in that manner. That is you have one black line that goes from the top of the color grid that it is in, to the bottom of that color grid. Or from side to side, depending on length.","To make the output, you have to... create one double path of light blue tiles, using the gray tile provided, to cover the color block that it is located in either horizontally or horizontally. You figure this out by determining which path would be larger and create single pink path in that style. That is have one brown path that goes from the right of the color block that it is in, to the left of that color block. Or from top to bottom, depending on width.","To make the output, you have to... build one single line of yellow tiles, using the blue tile provided, to cover the color line that it is located in either vertically or vertically. You figure this out by determining which line would be shorter and create single red line in that appearance. That is you have one yellow pyramid that goes from the bottom of the color line that it is in, to the top of that color line. Or from side to side, depending on height.",3
202,85c4e7cd,"To make the output, you have to...replace the outer most color with the inner most colors and complete the same steps with every color until all have been changed. In other words, keep the order of the colors.","To make the output, you have to...replace the inner most color with the same color and complete the same steps with every color until all have been changed. In other words, keep the order of the colors.","To make the output, you have to...replace only the black pixels with the green ones. Then, change the color of yellow pixels to gray. Such that the order of remaining colors remains the same.","To make the output, you have to...replace the inner most color with the next outer one and complete the same steps with every color until all have been changed. In other words, rotate the colors.","To make the output, you have to...replace the inner most color with the outer most colors and complete the same steps with every color until all have been changed. In other words, invert the order of the colors.",5
203,868de0fa,"To make the output, you have to...fill the squares with an even number grid inside the blue border with red, and the rest (2x2, 4x4, 6x6) squares with the color you get from yellow.","To make the output, you have to...fill the circles with an even number grid inside the blue border with red, and the rest (1x1, 3x3, 5x5) squares with the color you get from orange.","To make the output, you have to...fill the squares with an even number grid inside the gray border with pink, and the rest (1x1, 3x3, 5x5) squares with the color you get from orange.","To make the output, you have to...fill the squares with an odd number grid inside the red border with orange, and the rest (2x2, 4x4, 6x6) squares with the color you get from blue.","To make the output, you have to...fill the squares with an even number grid inside the blue border with red, and the rest (1x1, 3x3, 5x5) squares with the color you get from orange.",5
204,8731374e,"To make the output, you have to...replicate the rectangle to be a background grid. Then make the vertical and horizontal line that crosses at the color pixel.","To make the output, you have to...replicate the circle to be a background grid. Then make the vertical and horizontal line that crosses at the color pixel.","To make the output, you have to...delineate the rectangle to be a background grid. Afterward, create the diagonal and lateral line that intersects at the color square.","To make the output, you have to...mirror the square to be the backdrop surface. Then construct the vertical and horizontal line that bisects at the color pixel.","To make the output, you have to...mimic the ellipse to be a background grid. Then make the curved and oblique line that crosses at the color pixel.",1
205,88a10436,"To make the output, you have to...copy the input 3x3 multi-colored shape on the right side of the green square. This square comprises the left of the 3x3 copy.","To make the output, you have to...copy the input 4x4 multi-colored shape on the left of the gray square. This square comprises the right of the 4x4 copy.","To make the output, you have to...copy the input 2x2 multi-colored shape in the middle of the pink square. This square comprises the middle of the 2x2 copy.","To make the output, you have to...copy the input 3x3 multi-colored shape ontop of the gray square. This square comprises the middle of the 3x3 copy.","To make the output, you have to...copy the input 3x3 multi-colored shape underneath the gray square. This square comprises the top of the 3x3 copy.",4
206,88a62173,"To make the output, you have to...duplicate a single 2x2 grid, which is identical in shape to the other 2x2 grid patterns, in the middle of the output grid.","To make the output, you have to...replicate a single 3x3 grid, which is different in shape from the other 2x3 grid patterns, at each of the four corners onto the output grid.","To make the output, you have to...mirror a single 2x2 grid, which is different in shape from the other 3x3 grid patterns, at each of the four corners onto the input grid.","To make the output, you have to...replicate a single 2x2 grid, which is different in shape from the other 2x2 grid patterns, at each of the four corners onto the output grid.","To make the output, you have to...implement a single 2x3 grid, which has similar shape to the other 2x2 grid patterns, at each of the four sides onto the output grid.",4
207,8.90E+14,"To make the output, you have to...copy the input grid. Next, find another area in the large grid with the same number and same shape of black grid as in the rectangle. However, it will only be black grid without the shape and the black grid might also be surrounded by black squares or have additional black squares around it. After you find the black grid, replicate the first shape with the black grid you find as the center. There should be two identical rectangles in the output grid.","To make the output, you have to...copy the input grid. Next, find another area in the large grid with the same number and same shape of black grid as in the rectangle. However, it will only be black grid without the shape and the black grid might also be surrounded by white squares or have additional white squares around it. After you find the black grid, replicate the second shape with the black grid you find as the center. There should be two identical rectangles in the output grid.","To make the output, you have to...copy the input grid. Next, find another area in the large grid with a different number and different shape of black grid as in the rectangle. However, it will only be black grid without the shape and the black grid might also be surrounded by black squares or have additional black squares around it. After you find the black grid, replicate the first shape with the black grid you find as the center. There should be two identical rectangles in the output grid.","To make the output, you have to...copy the input grid. Next, find another area in the large grid with the same number and same shape of white grid as in the rectangle. However, it will only be black grid without the shape and the black grid might also be surrounded by black squares or have additional black squares around it. After you find the black grid, replicate the first shape with the black grid you find as the center. There should be two identical rectangles in the output grid.","To make the output, you have to...copy the input grid. Next, find another area in the small grid with the same number and same shape of black grid as in the rectangle. However, it will only be black grid without the shape and the black grid might also be surrounded by black squares or have additional black squares around it. After you find the black grid, replicate the first shape with the black grid you find as the center. There should be one identical rectangles in the output grid.",1
208,8a004b2b,"To make the output, you have to...record the portion equivalent to the dark corner squares into the output pattern. Next, duplicate the small image of the object diagram that was inside the blue corner squares within the blue corner squares.","To make the output, you have to...copy the section relative to the light blue corner squares into the output frame. Subsequently, replicate the shrunk picture of the object sketch that was outside the green corner squares within the green corner squares.","To make the output, you have to...copy the section matching the red corner squares into the output grid. Afterwards, recreate the contracted image of the object pattern that was inside the dark corner squares within the dark corner squares.","To make the output, you have to...copy the portion corresponding to the yellow corner squares into the output grid. Next, recreate the enlarged image of the object pattern that was outside the yellow corner squares within the yellow corner squares.","To make the output, you have to...transfer the part which is corresponding to the green corner squares into the output grid. Then, reproduce the smaller image of the object pattern that was inside the light blue corner squares within the light blue corner squares.",4
209,8be77c9e,"To make the output, you have to...empty the top of the grid with the same as original. And fill the bottom of the grid with a mirror image of the original.","To make the output, you have to...fill the left side of the grid with the same as original. And fill the right side of the grid with a mirror image of the original.","To make the output, you have to...fill the top of the grid with a mirror image of the original. And fill the bottom of the grid with the same as the original.","To make the output, you have to...fill the entire grid with the same as original. And ignore about the mirror image of the original.","To make the output, you have to...fill the top of the grid with the same as original. And fill the bottom of the grid with a mirror image of the original.",5
210,8d5021e8,"To make the output, you have to...put the input grid in the center of your output grid. then create repeat the patterns but flip them.","To make the output, you have to...put the input grid on the top of your output grid. Then recreate the patterns but distort them.","To make the output, you have to...put the input grid at the edge of your output grid. Then reproduce the patterns but shuffle them.","To make the output, you have to...put the input grid in the corner of your output grid. Then replicate the patterns but invert them.","To make the output, you have to...put the input grid on the right of your output grid. Then repeat the patterns but rotate them.",1
211,8d510a79,"To make the output, you have to...complete a line with the colors. If it's red, ignore the line until you hit the gray bar. If it's blue, ignore until you hit the bottom or top edge.","To make the output, you have to...skip a line with the colors. If it's red, fill the line in until you hit the gray bar. If it's blue, fill in until you hit the bottom or top edge.","To make the output, you have to...complete a line with the colors. If it's red, fill the line in until you hit the gray bar. If it's blue, fill in until you hit the bottom or top edge.","To make the output, you have to...keep a track of colors. If it's black, fill the line in until you hit the gray bar. If it's light blue, fill in until you hit the bottom or top edge.","To make the output, you have to...complete a line with the colors. If it's green, fill the line in until you hit the brown bar. If it's yellow, fill in until you hit the bottom or top edge.",3
212,8e1813be,"To make the output, you have to...repeat the color lines in the same horizontal or vertical order as they appear in the input. The lines should go all the way across the grid to form stripes that are in the same color order and orientation as the input.","To make the output, you have to...repeat the color lines in the same diagonal order as they appear in the input. The lines should go all the way across the grid to form stripes that are in the same color order and orientation as the input.","To make the output, you have to...repeat the color circles in the same horizontal or vertical order as they appear in the input. The lines should go all the way across the grid to form stripes that are in the same color order and orientation as the input.","To make the output, you have to...repeat the color lines in the same horizontal or vertical order as they appear in the input. The lines should stop halfway across the grid to form stripes that are in the same color order and orientation as the input.","To make the output, you have to...repeat the color lines in a different horizontal or vertical order as they appear in the input. The lines should go all the way across the grid to form stripes that are in a different color order and orientation as the input.",1
213,8e5a5113,"To make the output, you have to...rotate the first square exactly 90 degrees to the right. Then in the next black square copy the color pattern. Then in the final black square rotate the pattern another 90 degrees.","To make the output, you have to...copy the first square exactly. Then in the next black square rotate the color pattern 90 degrees to the right. Then in the final black square rotate the pattern another 90 degrees.","To make the output, you have to...copy the first square exactly. Then in the next black square flip the color pattern. Then in the final black square rotate the pattern 180 degrees to the left. ","To make the output, you have to...invert the colors of the first square exactly. Then in the next black square rotate the color pattern 90 degrees to the right. Then in the final black square rotate the pattern another 90 degrees.","To make the output, you have to...copy the first square exactly. Then in the next pink square rotate the color pattern 180 degrees to the right. Then in the final black square rotate the pattern another 90 degrees.",2
214,8eb1be9a,"To make the output, you have to...replicate the input grid, then invent a new pattern to fill in the whole black background.","To make the output, you have to...copy the input grid, then use a completely different pattern to fill in the whole black background.","To make the output, you have to...copy the input grid, then copy the exact same pattern to fill in the whole black background.","To make the output, you have to...copy the input grid, then distort the same pattern to fill in the whole black background.","To make the output, you have to...completely reinvent the input grid, then copy the exact same pattern to fill in the whole black background.",3
215,8efcae92,"To make the output, you have to...make the grid smaller than the shape and the colors are completely different from the shape.","To make the output, you have to...make the grid larger than the shape and the two colors are not like in shape at all.","To make the output, you have to...change the grid size and use different colors from the shape.","To make the output, you have to...make the grid the same size as the shape and the two colors are just like in the shape.","To make the output, you have to...make the grid the same size as the shape but only use one color like in the shape.",4
216,8f2ea7aa,"To make the output, you have to...imagine the original pattern is a 9x9 grid. What you need to do is copy the pattern in the 9x9 to the 3x3 grid. So you have 3 3x3 grid inside of the bigger grid(Top left, top middle, top right, middle left, middle, middle right, bottom left, bottom middle, bottom right). For example if the input pattern is a l shape you would only copy this to the top left, left and bottom left grid.","To make the output, you have to...understand the original pattern is a 3x3 grid. What you need to do is translate the pattern in the 3x3 to the 9x9 grid. As a result, you have 9 3x3 grid around the bigger grid(Top left, top middle, top right, middle left, middle, middle right, bottom left, bottom middle, bottom right). For instance if the input pattern is a square shape you would only translate this to the top middle, central and bottom middle grid.","To make the output, you have to...consider the original pattern is a 3x3 grid. What you need to do is mirror the pattern in the 3x3 to the 9x9 grid. Instead, you have 9 3x3 grid outside of the bigger grid(Top left, top middle, top right, middle left, middle, middle right, bottom left, bottom middle, bottom right). For instance if the input pattern is a l shape you would only mirror this to the top right, right and bottom right grid.","To make the output, you have to...visualize the original pattern is a 3x3 grid. What you need to do is rotate the pattern In the 3x3 to the 9x9 grid. Therefore, you have 9 3x3 grid underneath of the bigger grid(Top left, top middle, top right, middle left, middle, middle right, bottom left, bottom middle, bottom right). For example if the input pattern is a l shape you would only rotate this to the top middle, center and bottom middle grid.","To make the output, you have to...imagine the original pattern is a 3x3 grid. What you need to do is copy the pattern in the 3x3 to the 9x9 grid. So you have 9 3x3 grid inside of the bigger grid(Top left, top middle, top right, middle left, middle, middle right, bottom left, bottom middle, bottom right). For example if the input pattern is a l shape you would only copy this to the top middle, middle and bottom middle grid.",5
217,90c28cc7,"To make the output, you have to...remove the group of same color grids.","To make the output, you have to...add more same color grids to the group.","To make the output, you have to...replace group of different color grids with single same color grid.","To make the output, you have to...replace group of same color grids with single same color grid.","To make the output, you have to...retain group of same color grids without any replacement.",4
218,90f3ed37,"To make the output, you have to...finish the line so that it is different from the top line but finish the line in blue.","To make the output, you have to...finish the line so that it is the same as the top line but finish the line in green.","To make the output, you have to...finish the line so that it is the same as the bottom line but finish the line in red.","To make the output, you have to...begin the line so that it is the same as the bottom line but start the line in blue.","To make the output, you have to...finish the line so that it is the same as the top line but finish the line in blue.",5
219,913fb3ed,"To make the output, you have to...surround green with gray color, light blue with brown and red with black.","To make the output, you have to...surround green with pink color, blue with yellow and red with light blue.","To make the output, you have to...surround green with pink color, light blue with yellow and red with blue.","To make the output, you have to...surround green with yellow color, light blue with pink and red with blue.","To make the output, you have to...surround pink with green color, yellow with light blue and red with blue.",3
220,91413438,"To make the output, you have to...make the output repeat the pattern horizontally from the bottom of the grid by the number of the colored grid on the background using the unique background explained above.","To make the output, you have to...make the output repeat the pattern horizontally from the middle of the grid by the number of the colored grid on the background using the unique background explained above.","To make the output, you have to...make the output repeat the pattern vertically from the bottom of the grid by the number of the colored grid on the background using the unique background explained above.","To make the output, you have to...make the output repeat the pattern horizontally from the top of the grid by the number of the colored grid on the background using the unique background explained above.","To make the output, you have to...make the output repeat the pattern vertically from the top of the grid by the number of the colored grid on the background using the unique background explained above.",4
221,91714a58,"To make the output, you have to...only copy the size and position of the solid pentagonal block, except other single colored pixels.","To make the output, you have to...only copy the size and position of the solid rectangular block, except other single colored pixels.","To make the output, you have to...only copy the color and position of the solid rectangular block, except other single colored pixels.","To make the output, you have to...only copy the size and position of the solid oval block, except other single colored pixels.","To make the output, you have to...only copy the size and color of the solid rectangular block, except other single colored pixels.",2
222,9172f3a0,"To make the output, you have to...keep the same color and rotate the pattern to create a 9x9 grid. Each tile in the input grid is a 3x3 grid pattern on the output.","To make the output, you have to...keep the same color and pattern but increase to a 30x30 grid. Each tile in the input grid is a 10x10 grid pattern on the output.","To make the output, you have to...keep same color and pattern but increase to a 9x9 grid. Each tile in the input grid is a 3x3 grid pattern on the output. ","To make the output, you have to...keep the same color and pattern but decrease to a 3x3 grid. Each tile in the input grid is a single pixel on the output.","To make the output, you have to...swap the colors but keep the same pattern on a 9x9 grid. Each tile in the input grid is a 3x3 grid pattern on the output.",3
223,928ad970,"To make the output, you have to...replicate the input grid. Then, using the color of the colored ellipse, make the smallest rectangle possible that will fit inside the four pink dots. The outside of the new ellipse should touch the inside of all four pink dots.","To make the output, you have to...copy the input grid. Then, using the color of the colored rectangle, make the largest rectangle possible that will fit inside the four grey dots. The outside of the new rectangle should touch the inside of all four grey dots.","To make the output, you have to...copy the input grid. Then, using the color of the colored polygon, make the largest rectangle possible that will fit inside the four light blue dots. The outside of the new rectangle should touch the inside of all four light blue dots.","To make the output, you have to...immitate the input grid. Then, using the color of the colored circle, make the largest square possible that will fit inside the four black dots. The outside of the new circle should contact the inside of all four black dots.","To make the output, you have to...clone the input grid. Then, using the color of the colored square, make the largest possible rectangle that will fit inside the four brown dots. The outside of the new square should be outside all four brown dots.",2
