task_id,task_name,shuffled_description1,shuffled_description2,shuffled_description3,shuffled_description4,shuffled_description5,answer
100,447fd412,"To make the output, you have to...copy the input grid, then copy the pattern based on the yellow part of the finished object. Regardless, any existing yellow pixels should be moved elsewhere. Furthermore, if the size has decreased, decrease the pattern size proportionally.","To make the output, you have to...copy the input rectangle, then copy the pattern based on the blue part of the finished object. However, rearrange the positions of the existing blue pixels. Also, if the size has increased, decrease the size of the pattern proportionally.","To make the output, you have to...redraw the input grid, then copy the pattern based on the green part of the incomplete object. However, remove all the existing green pixels from their positions. Also, if the shape has changed, modify the size of the pattern randomly.","To make the output, you have to...copy the input grid, then copy the pattern based on the red part of the completed object. However, all the positions of the existing red pixels must remain fixed. Also, if the size has increased, increase the size of the pattern proportionally.","To make the output, you have to...copy the input square, then recreate the pattern based on the black part of the unfinished object. However, all the positions of the existing black pixels must move randomly. Also, if the size has decreased, increase the size of the pattern disproportionally.",4
101,44d8ac46,"To make the output, you have to...fill the black area within the gray with red if it is a square; otherwise, leave it alone.","To make the output, you have to...fill the pink area within the brown with Black if it is a square; otherwise, leave it alone.","To make the output, you have to...fill the blue area within the light blue with Green if it is a square; otherwise, leave it alone.","To make the output, you have to...fill the gray area within the green with Yellow if it is a square; otherwise, leave it alone.","To make the output, you have to...fill the red area within the black with Gray if it is a square; otherwise, leave it alone.",1
102,44f52bb0,"To make the output, you have to...fill in the pixels with yellow if the input is symmetrical, and with brown if it is not.","To make the output, you have to...fill in the pixels with red if the input is symmetrical, and with light blue if it is not.","To make the output, you have to...fill in the pixels with green if the input is symmetrical, and with black if it is not.","To make the output, you have to...fill in the pixels with gray if the input is symmetrical, and with pink if it is not.","To make the output, you have to...fill in the pixels with blue if the input is symmetrical, and with orange if it is not.",5
103,4522001f,"To make the output, you have to...make grid 8x8. Note the diagonal that the red square is in in the input. The green square in the diagonal will indicate which corner in the output you should put a 3x3 yellow square in the output. The red square suggests which corner another 3x3 yellow square will touch it your new square in the output grid. So you will have two yellow 3x3 squares touching each other corner to corner.","To make the output, you have to...make grid 9x9. Note the diagonal that the red square is in in the input. The green square in the diagonal will indicate which corner in the output you should put a 4x4 green square in the output. The red square indicates which corner another 4x4 green square will touch it your new square in the output grid. So you will have two green 4x4 squares touching each other corner to corner.","To make the output, you have to...make grid 6x6. Note the diagonal that the red square is in in the input. The green square in the diagonal will indicate which corner in the output you should put a 2x2 brown square in the output. The red square suggests which corner another 2x2 brown square will touch it your new square in the output grid. So you will have two brown 2x2 squares touching each other corner to corner.","To make the output, you have to...make grid 9x9. Note the diagonal that the blue square is in in the input. The yellow square in the diagonal will indicate which corner in the output you should put a 4x4 gray square in the output. The blue square indicates which corner another 4x4 gray square will touch it your new square in the output grid. So you will have two gray 4x4 squares touching each other corner to corner.","To make the output, you have to...make grid 10x10. Note the diagonal that the blue square is in in the input. The brown square in the diagonal will indicate which side in the output you should put a 5x5 pink square in the output. The blue square indicates which side another 5x5 pink square will touch it your new square in the output grid. So you will have two pink 5x5 squares touching each other side to side.",2
104,4612dd53,"To make the output, you have to...reconnect the sides of the rectangle(s). Use red to fill in the missing pieces of the sides in a straight line, rebuilding the rectangle(s). You should end up with one or two rectangles.","To make the output, you have to...disconnect the sides of the rectangle(s). Use red to fill in the missing pieces of the sides in a straight line, rebuilding the rectangle(s). You should end up with one or two rectangles.","To make the output, you have to...reconnect the sides of the rectangle(s). Use blue to fill in the missing pieces of the sides in a straight line, rebuilding the rectangle(s). You should end up with one or two rectangles.","To make the output, you have to...reconnect the corners of the rectangle(s). Use red to fill in the missing pieces of the corners in a straight line, rebuilding the rectangle(s). You should end up with one or two rectangles.","To make the output, you have to...reconnect the sides of the square(s). Use red to fill in the missing pieces of the sides in a straight line, rebuilding the square(s). You should end up with one or two squares.",1
105,46442a0e,"To make the output, you have to...create a grid of the same size of the input. Divide the output grid into 4 quadrants. Replicate the input grid pixels in the upper right quad. In the upper left quad, place the input grid that's been rotated 180 degrees. In the lower left quad, place the input grid colored pixels that has been rotated 90 degrees counter-clockwise. In the lower right quad place a copy of the input grid that's been rotated 90 degrees clockwise.","To make the output, you have to...create a grid four times the size of the input. Divide the output grid into 4 quadrants. Replicate the input grid pixels in the lower right quad. In the upper left quad, place the input grid that's been rotated 90 degrees clockwise. In the lower left quad, place the input grid colored pixels that has been rotated 180 degrees. In the upper right quad place a copy of the input grid that's been rotated 90 degrees counter-clockwise.","To make the output, you have to...create a grid twice the size of the input. Divide the output grid into 4 quadrants. Replicate the input grid pixels in the upper right quad. In the upper left quad, place the input grid that's been rotated clockwise 90 degrees. In the lower right quad, place the input grid colored pixels that has been rotated 180 degrees. In the lower left quad place a copy of the input grid that's been rotated 90 degrees counter-clockwise.","To make the output, you have to...create a grid half the size of the input. Divide the output grid into 4 quadrants. Replicate the input grid pixels in the upper right quad. In the upper left quad, place the input grid that's been rotated clockwise 90 degrees. In the lower right quad, place the input grid colored pixels that has been rotated 90 degrees. In the lower left quad place a copy of the input grid that's been rotated 180 degrees counter-clockwise.","To make the output, you have to...create a grid twice the size of the input. Divide the output grid into 4 quadrants. Replicate the input grid pixels in the lower left quad. In the upper left quad, place the input grid that's been rotated counter-clockwise 90 degrees. In the lower right quad, place the input grid colored pixels that has been rotated 180 degrees. In the upper right quad place a copy of the input grid that's been rotated 90 degrees clockwise.",3
106,469497ad,"To make the output, you have to...duplicate the input design in the extra large output grid. For the boundary, the number of colors on the grid spells out the number of rows. So, a grid with 7 colors will have 7 rows on the left and 7 on the right. For the separate gray block, the total number of colors should be multiplied by 2 to find out its size. So, a grid with 7 colors would reveal that the block would be 16x16. Lastly, construct a row of brown squares initiating from each edge of the separate block and ending either at the gray border or the edge of the grid.","To make the output, you have to...reproduce the input pattern in the smaller output grid. For the boundary, the number of colors on the grid signifies the number of rows. Thus, a grid with 5 colors would have 5 columns on top and 5 on the left. For the separate brown block multiply the number of colors by 3 to figure out its size. Consequently, a grid with 5 colors would imply the block would be 15x15. Lastly, make a column of green squares kicking off from each corner of the distinct block and finishing at either the brown border or the edge of the grid.","To make the output, you have to...copy the input pattern in the bigger output grid. For the boundary, the total colors on the grid concludes the number of columns. So, a grid with 3 colors would have 3 columns on the left and 3 on the bottom. For the separate pink block triple the total number of colors to determine its dimension. So, a grid with 3 colors would mean the block would be 9x9. Lastly, make a row of blue squares starting from each edge of the separate block and finishing at either the pink boundary or the edge of the grid.","To make the output, you have to...recreate the input pattern in the larger output grid. For the border, the number of colors on the grid determines how many rows. So, a grid with 4 colors would have 4 rows on the bottom and 4 on the right, For the separate colored block multiply the number of colors by 2 in order to determine its size. So, a grid with 4 colors would mean the block would be 8x8. Finally, make a row of red squares extending from each corner of the separate block and ending at either the colored border or the edge of the grid.","To make the output, you have to...replicate the input pattern in the larger output grid. For the border, the number of shades on the grid decides the total number of rows. Thus, a grid with 6 shades would have 6 rows on the top and 6 on the right. For the separate yellow block double the number of shades to determine its size. Consequently, a grid with 6 shades would state the block would be 12x12. At the end, make a row of black squares originating from each corner of the separate block and concluding either at the yellow border or the edge of the grid.",4
107,46f33fce,"To make the output, you have to...reduce colored 3x3 pixels to a 1x1 size. This process means the pixels in the downward, rightward, and diagonal right-downwards of the colored pixel must be filled to form a 1x1 crate. Afterward, while halving the overall grid size, the shrunken colored pixels should have transformed to 2x2 pixels. It's essential to maintain the initial positions for the 2x2 pixels from the previous ones.","To make the output, you have to...expand colored 1x1 pixels to a 2x2 size. In this process, the size should increase in the top-left direction, meaning the pixels in the upward, leftward, and upper-left diagonal directions of the colored pixel should be filled to create a 2x2 cube. Afterward, while doubling the entire grid size, the enlarged colored pixels should also be transformed into 4x4 pixels. It is essential to maintain the same positions for the 4x4 pixels as the previous ones.","To make the output, you have to...grow colored 1x1 pixels to a 2x2 structure. On the contrary, the size should increase in the bottom-right direction, meaning the pixels in the downward, rightward, and diagonal right-downwards of the colored pixel must be filled to form a 2x2 crate. Later, while doubling the overall grid size, the magnified colored pixels would still stay as 1x1 pixels. It's critical to change the initial positions for the 1x1 pixels from the previous ones.","To make the output, you have to...resize colored 1x1 pixels to a 2x2 shape. However, the size should decrease in the lower-right direction, meaning the pixels in the downward, rightward, and lower-right diagonal directions of the colored pixel should be cleared to create a 2x2 figure. Subsequently, while halving the entire grid size, the shrunken colored pixels should also be transformed into 1x1 pixels. It is necessary to alter the original positions for the 1x1 pixels from the previous ones.","To make the output, you have to...contract colored 2x2 pixels to a 1x1 size. This implies the pixels in the upward, leftward, and upper-left diagonal edges of the colored pixel should be removed to create a 1x1 cube. Then, the entire grid size has to be halved, the contracted colored pixels will stay as 1x1 pixels. It's mandatory to relocate the assigning positions for the 1x1 pixels from the initial ones.",2
108,47c1f68c,"To make the output, you have to...copy the reflection of the object located in the top-left corner to the remaining portions based on the vertical and horizontal lines dividing the grid into four quadrants. Then, remove the dividing vertical and horizontal lines and concatenate the quartered images.","To make the output, you have to...duplicate the shadow of the shape found in the bottom-right quadrant to the leftover areas relying on the vertical and horizontal lines splitting the grid into four sections. Then, delete the separating vertical and horizontal lines and merge the quartered figures.","To make the output, you have to...create an echo of the figure seen in the top-left section to the rest of the parts guided by the vertical and horizontal lines breaking the grid into four sectors. Later, exclude the cutting vertical and horizontal lines and bind the quartered illustrations.","To make the output, you have to...mimic the reflection of the object situated in the bottom-left corner to the leftover sections based on the vertical and horizontal lines dividing the grid into four quarters. Then, remove the dividing vertical and horizontal lines and unify the quartered images.","To make the output, you have to...mirror the reflection of the entity placed in the top-right quadrant to the remaining portions atop the vertical and horizontal lines cleaving the grid into four divisions. Henceforth, eliminate the dividing vertical and horizontal lines and fuse the quartered images.",1
109,484b58aa,"To make the output, you have to...fill in the green spaces with the continued pattern that is in the rest of the input so it looks like there is a uniform pattern on the whole grid.","To make the output, you have to...fill in the black spots with the reversed pattern that is in the rest of the input so it looks like there is a varying pattern on the whole grid.","To make the output, you have to...fill in the black spots with the continued pattern that is in the rest of the input so it looks like there is a uniform pattern on the whole grid.","To make the output, you have to...fill in the black spots with the continued pattern that is in the rest of the input so it looks like there is a divided pattern on the whole grid.","To make the output, you have to...leave the black spots empty and continue the pattern that is in the rest of the input so it looks like there is a uniform pattern on the whole grid.",3
110,48d8fb45,"To make the output, you have to...repeat the colored area that includes a pink square, but do not include the pink square.","To make the output, you have to...repeat the black area that includes a black square, but do not include the gray square.","To make the output, you have to...repeat the colored area that includes a gray square, but do not include the gray square.","To make the output, you have to...repeat the colored area that includes a blue square, but do not include the blue square.","To make the output, you have to...repeat the colored area that includes a brown square, but do not include the brown square.",3
111,4938f0c2,"To make the output, you have to...use the same red pattern to create an asymmetrical pattern surrounding the green cube.","To make the output, you have to...use the same red pattern to create a symmetrical pattern surrounding the purple cube.","To make the output, you have to...use the different red pattern to create a symmetrical pattern surrounding the green pyramid.","To make the output, you have to...use the same red pattern to create a symmetrical pattern surrounding the green cube.","To make the output, you have to...use the different black pattern to create a unsymmetrical pattern surrounding the green cube.",4
112,496994bd,"To make the output, you have to...invert the input grid, then replicate the colored lines at the other end.","To make the output, you have to...mirror the blank grid, then draw the colored lines on the other end.","To make the output, you have to...copy the input grid and then mirror the colored lines on the other end of the grid.","To make the output, you have to...copy the green colored squares then rotate them at the other end.","To make the output, you have to...copy the input grid, but place the colored lines at random places.",3
113,49d1d64f,"To make the output, you have to...shrink the pixels at the corners of the grid to a 2x2 size. For pixels along the left and right edges of the grid, which are not at the corners, shrink them to 1x2. Conversely, for pixels along the top and bottom edges of the grid, which are not at the corners, shrink them to 2x1. If a pixel is neither at the corner nor along the grid edges, leave it as a 1x1 pixel. After all the shrinking, color the corners of the newly created grid in blue.","To make the output, you have to...expand the pixels at the sides of the grid to a 2x2 size. For pixels along the top and bottom edges of the grid, which are not at the sides, expand them to 1x2. Conversely, for pixels along the left and right edges of the grid, which are not at the sides, expand them to 2x1. If a pixel is neither at the side nor along the grid edges, leave it as a 1x1 pixel. After all the expansions, color the sides of the newly created grid in gray.","To make the output, you have to...expand the pixels at the corners of the grid to a 1x1 size. For pixels along the left and right edges of the grid, which are not at the corners, expand them to 2x1. Conversely, for pixels along the top and bottom edges of the grid, which are not at the corners, expand them to 1x2. If a pixel is neither at the corner nor along the grid edges, leave it as a 2x2 pixel. After all the expansions, color the corners of the newly created grid in yellow.","To make the output, you have to...expand the pixels at the corners of the grid to a 2x2 size. For pixels along the left and right edges of the grid, which are not at the corners, expand them to 1x2. Conversely, for pixels along the top and bottom edges of the grid, which are not at the corners, expand them to 2x1. If a pixel is neither at the corner nor along the grid edges, leave it as a 1x1 pixel. After all the expansions, color the corners of the newly created grid in black.","To make the output, you have to...expand the pixels at the center of the grid to a 2x2 size. For pixels along the right and left edges of the grid, which are not at the center, expand them to 1x2. Conversely, for pixels along the bottom and top edges of the grid, which are not at the center, expand them to 2x1. If a pixel is neither at the center nor along the grid edges, leave it as a 1x1 pixel. After all the expansions, color the edges of the newly created grid in black.",4
114,4be741c5,"To make the output, you have to...identify the new shapes in the input grid image. Take the colors of the distinct shapes in the input grid's image. If the input image is horizontal, the output grid should also be composed of horizontal single pixels, and vice versa.","To make the output, you have to...interpret the texture of the input grid image. Record the colors of the similar boundaries in the input grid's image. If the input image is vertical, the output grid should also be composed of vertical single pixels, and vice versa.","To make the output, you have to...identify the shape of the input grid image. Take the colors of the distinct boundaries in the input grid's image. If the input image is vertical, the output grid should also be composed of vertical single pixels, and vice versa.","To make the output, you have to...identify the color palette of the input grid image. Take the colors of the distinct boundaries in the input grid's image. If the input image is horizontal, the output grid should also be composed of horizontal single pixels, and vice versa.","To make the output, you have to...create some random colors. Take the shades of the different boundaries in the input grid's image. If the input image is horizontal, the output grid should also be composed of horizontal single pixels, and vice versa. ",4
115,4c4377d9,"To make the output, you have to...subtract the input grid flipped horizontally below it.","To make the output, you have to...append the input grid flipped vertically above it.","To make the output, you have to...append the input grid flipped horizontally above it.","To make the output, you have to...exclude the input grid flipped vertically below it.","To make the output, you have to...append the input grid flipped diagonally above it.",2
116,4c5c2cf0,"To make the output, you have to...mirror the shape at the corner of the o to the other corners of the o so that the o is surrounded by the corner shape.","To make the output, you have to...mirror the shape at the corner of the x to the other corners of the x so that the x is surrounded by the corner shape.","To make the output, you have to...place the shape at the corner of the x to the other corners of the x so that the x is surrounded by the corner shape.","To make the output, you have to...mirror the shape at the corner of the y to the other corners of the y so that the y is surrounded by the corner shape.","To make the output, you have to...mirror the shape at the middle of the x to the other corners of the x so that the x is surrounded by the corner shape.",2
117,50846271,"To make the output, you have to...fill the area that have green units with brown blocks to make crosses with vertical and horizontal units that make up each of them.","To make the output, you have to...fill in gray units in the area that have red units with red blocks to make crosses with vertical and horizontal units that make up each of the crosses.","To make the output, you have to...fill in only red units in the crosses with gray blocks to make vertical and horizontal units. ","To make the output, you have to...fill in yellow units in the area that have blue units with blue blocks to make triangles with vertical and horizontal units that make up each of the triangles.","To make the output, you have to...fill in red units in the area that have gray units with gray blocks to make vertical and horizontal units that make up each of the circles. ",2
118,508bd3b6,"To make the output, you have to...fill the pixels with green color vertically progressing through the light blue pixels. When encountering the red portion, consider it as a wall, and let the green pixel progression stop there.","To make the output, you have to...fill the pixels with green color diagonally progressing through the light blue pixels. When encountering the red portion, consider it as a mirror, and reflect the direction of the green pixel progression as if it were reflecting off the mirror.","To make the output, you have to...fill the pixels with black color diagonally progressing through the light blue pixels. When encountering the red portion, consider it as a window, and let the black pixel progression pass through it.","To make the output, you have to...fill the pixels with green color diagonally progressing through the brown pixels. When encountering the yellow portion, consider it as a mirror, and reflect the direction of the green pixel progression as if it were reflecting off the mirror.","To make the output, you have to...fill the pixels with light blue color diagonally progressing through the green pixels. When encountering the red portion, consider it as a mirror, and reflect the direction of the light blue pixel progression as if it were reflecting off the mirror.",2
119,50cb2852,"To make the output, you have to...fill the shapes in with dark blue color but leave the cubes on the edge the same color as the input grid.","To make the output, you have to...fill the shapes in with light blue colors and also paint the cubes on the edge the same color as the input grid.","To make the output, you have to...fill the shapes in with light blue colors but leave the cubes on the edge the same color as the input grid.","To make the output, you have to...color the shapes with light blue colors but paint the cubes on the edge the same color as the input grid.","To make the output, you have to...fill the shapes in with light blue colors but change the cubes on the edge to a different color from the input grid.",3
