task_id,task_name,shuffled_description1,shuffled_description2,shuffled_description3,shuffled_description4,shuffled_description5,answer
0,007bbfb7,"To make the output, you have to...form a black 7x7 grid. Every single point in a 7x7 output grid can be perceived as a 3x3 grid, and each of these points correspond to a location in the 2x2 input grid. You are required to duplicate the pattern of the input grid onto the output grid. However, the number of duplicates on the output grid is calculated by the number of colored pixels on the input grid. And the exact place of the copied pattern on the output grid also follows the spot of each of the colored squares on the input grid.","To make the output, you have to...create a blue 9x9 grid. Each placement in a 9x9 output grid can be identified as a 3x3 grid, and every one of these positions corresponds to a spot in the 3x3 input grid. You have to paste the pattern of the input grid onto the output grid. However, the numeral of duplicates on the output grid is dependent on the number of colored pixels on the input grid. And the location of the copied pattern on the output grid also follows the location of every one of the colored squares on the input grid.","To make the output, you have to...construct a black 9x9 grid. Each area in a 9x9 output grid can be separated as a 2x2 square, and each of these areas relate to a location in the 2x2 input grid. You must reproduce the pattern of the input grid onto the output grid. However, the total copies on the output grid are determined by the total number of colored pixels on the input grid. And the exact location of the copied pattern on the output grid follows the exact location of each of the colored rectangles on the input grid.","To make the output, you have to...create a black 9x9 grid. Each position in a 9x9 output grid can be distinguished as a 3x3 grid, and each of these positions corresponds to a location in the 3x3 input grid. You have to copy the pattern of the input grid onto the output grid. However, the number of copies on the output grid is determined by the number of colored pixels on the input grid. And the location of the copied pattern on the output grid also follows the location of each of the colored squares on the input grid.","To make the output, you have to...create a black 10x10 grid. Every position in an 8x8 output grid can be seen as a 2x2 grid, and each of these corresponds to an area in the 4x4 input grid. You must copy the shape of the input grid onto the output grid. However, the number of copies on the output grid is given by the amount of colored pixels on the input grid. Also, the place of the copied pattern on the output grid mimics the place of each of the colored rectangles on the input grid.",4
1,00d62c1b,"To make the output, you have to...examine the grey pattern in the input. Identify any empty areas of blocks enclosed by the pattern and fill those enclosed parts with yellow.","To make the output, you have to...examine the green pattern in the output. Identify any empty areas of blocks enclosed by the pattern and fill those enclosed parts with yellow.","To make the output, you have to...examine the green pattern in the input. Identify any empty areas of blocks enclosed by the pattern and fill those enclosed parts with brown.","To make the output, you have to...examine the green pattern in the input. Identify any empty areas of blocks enclosed by the pattern and fill those enclosed parts with yellow.","To make the output, you have to...examine the green pattern in the input. Identify any full areas of blocks enclosed by the pattern and fill those enclosed parts with yellow.",4
2,017c7c7b,"To make the output, you have to...identify a repeating green pixel pattern in a 10x5 grid pattern. And fill the repeated pattern with black pixels on a 12x5 grid.","To make the output, you have to...identify a repeating gray pixel pattern in a 8x4 grid pattern. And fill the repeated pattern with brown pixels on a 11x4 grid.","To make the output, you have to...identify a repeating light blue pixel pattern in a 6x3 grid pattern. And fill the repeated pattern with pink pixels on a 9x3 grid.","To make the output, you have to...identify a repeating blue pixel pattern in a 4x2 grid pattern. And fill the repeated pattern with yellow pixels on a 7x2 grid.","To make the output, you have to...identify a repeating blue pixel pattern in 6x3 grid pattern. And fill the repeated pattern with red pixels on a 9x3 grid.",5
3,025d127b,"To make the output, you have to...copy input grid over. find the bottom of the shape. Everything except the bottom row and the block that connect to the bottom row on the left side will have shifted one block over to the left.","To make the output, you have to...mirror the input grid. find the bottom of the shape. Everything but the lowest row and the rectangle linking the lowest row on the left will have been moved one block to the right.","To make the output, you have to...copy input grid over. find the bottom of the shape. Everything except the bottom row and the block that connect to the bottom row on the right side will have shifted one block over to the left.","To make the output, you have to...rotate the input grid 90 degrees. find the bottom of the shape. Everything except the bottom row and the block that connect to the bottom row on the right side will have shifted one block over to the left.	","To make the output, you have to...copy input grid over. find the top of the shape. Everything except the top row and the block that connect to the top row on the left side will have shifted one block over to the right.",2
4,045e512c,"To make the output, you have to...copy the background color, starting from the middle of the grid and expand it till the edge, completing or not the shape.","To make the output, you have to...magnify the reference shape, starting from the color of the corner blocks and then repeat that pattern to the center of the grid, regardless of requiring an incomplete formation. ","To make the output, you have to...illustrate the contrasting shape, beginning with the color of the surrounding blocks and then replicate it to the core of the grid, even if it needs an incomplete figure.","To make the output, you have to...replicate the reference shape, using the color of the other blocks as a start point and then replicate that pattern to the edge of the grid, even if it needs a incomplete shape.","To make the output, you have to...create a duplicate of the opposing shape, taking the color from the outer blocks as a start point and then carry that pattern to the brink of the grid, irrespective of it needing an incomplete design.",4
5,0520fde7,"To make the output, you have to...look at both the left and right parts of the input grid. You will notice that the left and right parts are 3x3. For each square that is colored on both the left and right parts, color the output grid with red on the new 3x3.","To make the output, you have to...look at both the top and bottom parts of the input grid. You will notice that the top and bottom parts are 3x3. For each square that is colored on both the top and bottom parts, color the output grid with green on the new 3x3.","To make the output, you have to...look at both the left and right parts of the input grid. You will notice that the left and right parts are 5x5. For each square that is colored on both the left and right parts, color the output grid with yellow on the new 3x3.","To make the output, you have to...look at both the left and right parts of the input grid. You will notice that the left and right parts are 4x4. For each square that is colored on both the left and right parts, color the output grid with blue on the new 3x3.","To make the output, you have to...look at both the left and right parts of the input grid. You will notice that the left and right parts are 6x6. For each square that is colored on both the left and right parts, color the output grid with black on the new 3x3.",1
6,5269061,"To make the output, you have to...fill the black grid with same pattern of row color, next row need to replace the same pattern of first row one column move shifted left.","To make the output, you have to...fill the black grid with same pattern of row color, next row need to keep the same pattern of first row.","To make the output, you have to...fill the black grid with same pattern of row color, next row need to replace the same pattern of first row except one column move shifted right.","To make the output, you have to...leave the black grid empty, next row need to replace the same pattern of first row one column move shifted left.","To make the output, you have to...fill the black grid with different pattern of row color, next row need to replace the same pattern of first row one column move shifted left.",1
7,05f2a901,"To make the output, you have to...keep the blue 3x3 rectangle in the same spot. Move the red shape until it is touching the blue 3x3 rectangle either vertically or horizontally.","To make the output, you have to...keep the green 2x2 square in the same spot. Move the red shape away from the green 2x2 square either vertically or horizontally.","To make the output, you have to...keep the blue 2x2 square in the same spot. Move the red shape away from the blue 2x2 square either vertically or horizontally.","To make the output, you have to...keep the red 2x2 square in the same spot. Force the blue shape to touch the red 2x2 square either vertically or horizontally.","To make the output, you have to...keep the blue 2x2 square in the same spot. the red shape needs to move until it is touching the blue 2x2 square. You should move the red shape towards the blue 2x2 square either vertically or horizontally.",5
8,06df4c85,"To make the output, you have to...fill the black 2x2 square grid with same color in between the two different color of 2x2 grid and connect.","To make the output, you have to...fill the black 3x3 square grid with same color in between the two same color of 3x3 grid and connect.","To make the output, you have to...fill the red 2x2 square grid with same color in between the two same color of 2x2 grid and connect.","To make the output, you have to...fill the black 2x2 square grid with same color in between the two same color of 2x2 grid and connect.","To make the output, you have to...fill the black 2x2 square grid with different color in between the two same color of 2x2 grid and connect.",4
9,08ed6ac7,"To make the output, you have to...change the color of the tallest to blue, then second talest to red,third tallest to green,then finally shortest to yellow for both pairs.","To make the output, you have to...change the color of the tallest to blue, then second tallest to green, third tallest to red, then finally shortest to yellow for both pairs.","To make the output, you have to...change the color of the shortest to red, then second shortest to blue, third shortest to green, then finally the tallest to yellow for both pairs.","To make the output, you have to...change the color of the shortest to green, then second shortest to red, third shortest to yellow, then finally the tallest to blue for both pairs.","To make the output, you have to...change the color of the shortest to blue, then second shortest to red, third shortest to green, then finally the tallest to yellow for both pairs.",1
10,09629e4f,"To make the output, you have to...find the square that has only four color blocks in the pattern. Leave the blocks in the output empty. The gray areas change.","To make the output, you have to...find the square that has only five color blocks in the pattern. Use that pattern to fill the blocks in the output. The gray areas stay the same.","To make the output, you have to...find the square that has only four color blocks in the pattern. Use that pattern to fill the blocks in the output. The gray areas stay the same.","To make the output, you have to...find the rectangle that has only three color blocks in the pattern. Use that pattern to fill the blocks in the output. The gray areas stay the same.","To make the output, you have to...find the square that has only four color blocks in the pattern. Use that pattern to change the blocks in the output. The pink areas stay the same.",3
11,0962bcdd,"To make the output, you have to...extend the plus sign one square in every direction and then make a 5x5 'X' of the center color through the center square. You should result in nine squares the color of the center and eight the color of the original plus sign.","To make the output, you have to...extend the plus sign two squares in every direction and then make a 5x5 'X' of the center color through the center hexagon. You should result in ten squares the color of the center and seven the color of the original plus shape.","To make the output, you have to...shrink the plus sign one square in every direction and then make a 4x4 'X' of the center color through the center triangle. You should result in seven squares the color of the center and ten the color of the original diamond shape.","To make the output, you have to...extend the plus sign one square in every direction and then make a 5x5 'X' of the center color through the center Pentagon. You should result in eleven squares the color of the center and six the color of the original plus sign.","To make the output, you have to...extend the plus sign one square in each direction and then make a 4x4 'X' of the center color through the center ellipse. You should result in eight squares the color of the center and nine the color of the original quadrant.",1
12,0a938d79,"To make the output, you have to...create a pattern of short stripes alternating between the 2 colors. Start from the first colored pixel and create a line that goes to the opposite side using that color. Then go to the last colored pixel and do the same. Continue the pattern of stripes to the left direction for a long grid or go up for a tall grid all the way to the end.","To make the output, you have to...create a pattern of dots alternating between the 2 colors. Start from the first colored pixel and create a line that goes to the opposite side using that color. Then go to the second colored pixel and do the same. Continue the pattern of dots to the right direction for a long grid or go down for a tall grid all the way to the end.","To make the output, you have to...create a pattern of short stripes alternating between the 2 colors. Start from the first colored pixel and create a line that goes to the opposite side using that color. Then go to the second colored pixel and do the same. Continue the pattern of stripes to the right direction for a long grid or go down for a tall grid all the way to the end.","To make the output, you have to...create a pattern of short stripes alternating between the 3 colors. Start from the first colored pixel and create a line that goes to the same side using that color. Then go to the second colored pixel and do the same. Continue the pattern of stripes to the left direction for a long grid or go up for a tall grid all the way to the start.","To make the output, you have to...create a pattern of short stripes alternating between the 2 colors. Start from the last colored pixel and create a circle that goes to the opposite direction using that color. Then go to the first colored pixel and do the same. Continue the pattern of stripes to the right direction for a tall grid or go down for a long grid all the way to the end.",3
13,0b148d64,"To make the output, you have to...distinguish between four sections colored in random patterns, and among these, identify the one section that is colored differently. Afterward, copy only the differently colored section into the output grid.","To make the output, you have to...distinguish between four sections colored in random patterns, and identify all the sections that are colored the same. Afterward, copy all the sections with the same color into the output grid.","To make the output, you have to...distinguish between three sections colored in random patterns, and identify the section that is colored differently. Afterward, ignore the differently colored section for the output grid.","To make the output, you have to...distinguish between four sections colored with the same pattern, and identify the one section that is colored differently. Afterward, erase only the differently colored section from the output grid.","To make the output, you have to...distinguish between four sections colored in random patterns, and among these, identify the one section that is not colored. Afterward, copy only the uncolored section into the output grid.",1
14,0ca9ddb6,"To make the output, you have to...copy the image exactly. Where there's a yellow square, put red squares at its corners (4 total). Where there's an orange square, put blue squares directly above and below it (4 total). Do nothing with gray or green squares.","To make the output, you have to...rotate the image exactly. Where there's a red square, put yellow squares at its corners (4 total). Where there's a blue square, put orange squares directly above and below it (4 total). Do nothing with light blue or pink squares.","To make the output, you have to...copy image exactly. Where there's a red square, put yellow squares at it's corners (4 total). Where there's a blue square, put orange squares directly above and below it (4 total). Do nothing with light blue or pink squares.","To make the output, you have to...mirror the image exactly. Where there's a red square, put yellow squares at its corners (4 total). Where there's a blue square, put orange squares directly above and below it (4 total). Do nothing with light blue or pink squares.","To make the output, you have to...copy the image exactly. Where there's a green square, put black squares at its corners (4 total). Where there's a gray square, put brown squares directly above and below it (4 total). Do nothing with red or blue squares.",3
15,0d3d703e,"To make the output, you have to...change the color of the grid column into specific color. grey to blue, light blue to brown, pink to red, green to yellow and vice versa.","To make the output, you have to...change the color of the grid row into specific color. Grey to blue, pink to brown, green to red, yellow to light blue and vice versa.","To make the output, you have to...maintain the color of the grid column. Grey stays grey, light blue stays light blue, pink stays pink, green stays green and vice versa.","To make the output, you have to...change the color of the pixel into specific color. Grey to blue, green to brown, red to pink, yellow to grey and vice versa.","To make the output, you have to...change the color of the grid column into specific color. Pink to blue, yellow to brown, green to red, light blue to grey and vice versa.",1
16,0dfd9992,"To make the output, you have to...erase the input grid completely. Fill in all white boxes to create a pattern.","To make the output, you have to...invert input grid. Fill in all black boxes to twist the pattern.","To make the output, you have to...overlay the input grid diagonally. Fill in all blue boxes to establish pattern.","To make the output, you have to...copy input grid exactly. Fill in all black boxes to draw establish pattern.","To make the output, you have to...mirror the input grid upside down. Fill all green boxes to make a new pattern.",4
17,0e206a2e,"To make the output, you have to...try to leave the empty space between the three color boxes as the original object given.","To make the output, you have to...try to fill up the empty space between the three color boxes as the original object given.","To make the output, you have to...try to fill up the filled space between the three color boxes as the original object given.","To make the output, you have to...try to fill up the empty space with brown color between the three color boxes as the original object given.","To make the output, you have to...try to fill up the empty space between the four color boxes as the original object given.",2
18,10fcaaa3,"To make the output, you have to...clone the input. Keep the output grid to the same width and height. Then, copy the upper-right quadrant of your output grid (which contradicts the input grid) and recycle it once in each quadrant of the output grid. You should have 4x as many colored squares in the output as in the input. Then, for each colored square in the output, do the following: The colored square should have no relationship with the light blue colored square. ","To make the output, you have to...return the input. Then, resize the output cube to be the same as the width and height. Then, copy the lower right quadrant of your output box (which is not identical to the input grid) and paste it once in each quadrant of the output square. You are limited to only one colored square in the output as in the input. Then, for each colored square in the output, do the following: An orange square should be added at random positions around the colored square without forming a specific pattern.","To make the output, you have to...copy the input. Then, resize the output grid to be double the width and height. Then, copy the upper-left quadrant of your output grid (which is the same as the input grid) and paste it once in each quadrant of the output grid. You should have 4x as many colored squares in the output as in the input. Then, for each colored square in the output, do the following: add a light blue square 1 above and to the left, 1 above and to the right, 1 below and to the left, 1 below and to the right. Each light blue square should be diagonally touching the colored square, forming an X with the colored square in the center. Some of the X's might overlap or go off the screen. That is okay.","To make the output, you have to...duplicate the input. Then, halve the size of the output grid in width and height. Then, isolate the bottom-right quadrant of your output grid (which is different from the input grid) and paste it once in each quadrant of the output grid. You should have only one colored square in the output as in the input. Then, for each colored square in the output, do the following: add a light blue square 1 above, 1 below, 1 to the left, 1 to the right. Each light blue square should be horizontally or vertically touching the colored square, forming a cross with the colored square in the center. None of the crosses should overlap or go off the screen. ","To make the output, you have to...cut and paste the input. Then, triple the space of the output grid regarding width and height. Then, copy the lower-left quadrant of your output grid (which is dissimilar from the input grid) and imprint it once in each quadrant of the output grid. You should have 2x as many colored squares in the output compared to input. Then, for each colored square in the output, do the following: add a light green square 1 above and to the left, 1 above and to the right, 1 below and to the left, 1 below and to the right.",3
19,11852cab,"To make the output, you have to...complete the pattern that is there by color each side with the color that is already there to complete the pattern.","To make the output, you have to...complete the pattern that is absent by coloring each side with the color that is there to complete the pattern.","To make the output, you have to...complete the pattern that is not there by color each side with the color that is not there to complete the pattern.","To make the output, you have to...finish the pattern that is not there by coloring each corner with the color that is not there to finish the pattern.","To make the output, you have to...complete the pattern that is not there by color each side with opposite color that is there to complete the pattern.",3
20,1190e5a7,"To make the output, you have to...keep the color of the grid to the color of the input lines not the grid. You need to adjust the number and positions of sections divided by lines of different colors horizontally and vertically according to the grid size.","To make the output, you have to...change the color of the lines to the color of the input grid not the lines. You need to adjust the number and positions of sections divided by lines of different colors horizontally and vertically according to the grid size.","To make the output, you have to...change the color of the grid to the color of the input grid not the lines. You need to adjust the number and positions of sections divided by lines of different colors horizontally and vertically according to the grid size.","To make the output, you have to...change the color of the grid to the color of the input grid not the lines. You don't need to adjust the number and positions of sections divided by lines of different colors horizontally and vertically according to the grid size.","To make the output, you have to...change the color of the grid to the color of the input lines not the grid. You need to adjust the number and positions of sections divided by lines of different colors horizontally and vertically according to the grid size.",3
21,137eaa0f,"To make the output, you have to...move each pattern so that the gray square in each pattern covers the corner square of the output 3x3 grid.","To make the output, you have to...move each pattern so that the gray square in each pattern occupies the center square of the output 3x3 grid.","To make the output, you have to...move each tile so that the gray square in each tile occupies the center square of the output 3x3 grid.","To make the output, you have to...move each pattern so that the gray rectangle in each pattern occupies the center rectangle of the output 3x3 grid.","To make the output, you have to...move each pattern so that the red square in each pattern occupies the center square of the output 3x3 grid.",2
