task_id,task_name,shuffled_description1,shuffled_description2,shuffled_description3,shuffled_description4,shuffled_description5,answer
294,bbc9ae5d,"To make the output, you have to...make each row the same as the row shown in the input grid. Add two more colored boxes in each row. So, if one row has 4 colored boxes, the next row also has 4 and so on...etc. This will look like a plateau when you are done. Keep going until the grid is finished.","To make the output, you have to...generate the rightmost column similarly as the column displayed in the input grid. Each column that moves left adds an extra colored box. So, if the rightmost column has 4 colored boxes, the next column to left has 5, the next has 6?etc. This will appear like a vertical staircase when you are finished. Continue until the grid is complete.","To make the output, you have to...make the bottom row the same as the row shown in the input grid. Every row that goes up subtracts one colored box. So, if the bottom row has 4 colored boxes, the next row up has 3 and then the next row has 2...etc. This will look like a ramp when you are done. Keep going until the grid is finished.","To make the output, you have to...make the top row the same as the row shown in the input grid. Every row that goes down adds one more colored box. So, if the top row has 4 colored boxes, the next row down has 5 and then the next row has 6...etc. This will look like a staircase when you are done. Keep going until the grid is finished.","To make the output, you have to...make the top row the same as the row shown in the input grid. Every row that goes down subtracts one more colored box. So, if the top row has 4 colored boxes, the next row down has 3 and then the next row has 2...etc. This will look an inverted staircase when you are done. Keep going until the grid is finished.",4
295,bc1d5164,"To make the output, you have to...imagine you are squishing the original grid horizontally and vertically. The colored dots move and overlap on top of the background.","To make the output, you have to... imagine you are flipping the original grid upside down and left to right. The colored dots move and overlap on top of the background.","To make the output, you have to... imagine you are rotating the grid to 360 degrees. The colored dots move and overlap on top of the background.","To make the output, you have to... imagine you are stretching the original grid vertically and horizontally. The colored dots separate and move away from the background.","To make the output, you have to... imagine you are shrinking the original grid diagonally. The colored dots move and overlap on top of the background.",1
296,bd4472b8,"To make the output, you have to...start on the third row (after the row of gray) and make the entire third row the different color from the first color in the first row, then make the entire fourth row the different color from the second color in the first row and so on for the next color. Once all colors have been done, then repeat the same pattern.","To make the output, you have to...start on the third row (after the row of gray) and make the entire third row the same as the first color in the first row, then make the entire fourth row the same as the second color in the first row and so on for the next color. Once all colors have been done, then repeat the same pattern.","To make the output, you have to...start on the third row (after the row of green) and make the entire third row the same as the first color in the first row, then make the entire fourth row the same as the second color in the first row and so on for the next color. Once all colors have been done, then repeat the same pattern.","To make the output, you have to...start on the fourth row (after the row of gray) and make the entire fourth row the same as the first color in the first row, then make the entire fifth row the same as the second color in the first row and so on for the next color. Once all colors have been done, then repeat the same pattern.","To make the output, you have to...start on the third column (after the column of gray) and make the entire third column the same as the first color in the first column, then make the entire fourth column the same as the second color in the first column and so on for the next color. Once all colors have been done, then repeat the same pattern.",2
297,bda2d7a6,"To make the output, you have to...change the color of center black 2x2 grid to that of 4X4 grid color, 6X6 change to 4X4 color, and 4X4 change to old 2X2 color","To make the output, you have to...change the color of center black 2x2 grid to that of 4X4 grid color, 4X4 change to 6X6 color, and 6X6 change to old 2X2 color","To make the output, you have to...change the color of center black 2x2 grid to that of 6X6 grid color, 4X4 change to 2X2 color, and 6X6 change to old 4X4 color","To make the output, you have to...change the color of center black 4x4 grid to that of 2X2 grid color, 6X6 change to 4X4 color, and 2X2 change to old 6X6 color","To make the output, you have to...change the color of center black 6x6 grid to that of 2X2 grid color, 4X4 change to 6X6 color, and 2X2 change to old 4X4 color",2
298,bdad9b1f,"To make the output, you have to...continue the pattern of blue squares horizontal and continue the red squares vertical to reach the edge of the grid. On the square that blue and red squares crosses, color that one pink.","To make the output, you have to...continue the pattern of red squares horizontal and continue the blue squares vertical to reach the edge of the grid. On the square that blue and red squares crosses, color that one yellow.","To make the output, you have to...continue the pattern of red squares vertical and continue the green squares horizontal to reach the edge of the grid. On the square that red and green squares crosses, color that one gray.","To make the output, you have to...continue the pattern of pink squares horizontal and continue the brown squares vertical to reach the edge of the grid. On the square that pink and brown squares crosses, color that one light blue.","To make the output, you have to...continue the pattern of yellow squares horizontal and continue the light blue squares vertical to reach the edge of the grid. On the square that yellow and light blue squares crosses, color that one green.",2
299,be94b721,"To make the output, you have to...fully zoom out pattern of a highest color count among the grid.","To make the output, you have to...partially zoom out pattern of a highest color count among the grid.","To make the output, you have to...fully zoom in pattern of a lowest color count among the grid.","To make the output, you have to...partially zoom in pattern of a lowest color count among the grid.","To make the output, you have to...fully zoom in pattern of a highest color count among the gird.",5
300,beb8660c,"To make the output, you have to...rearrange the lines from smallest at the bottom of the grid to largest at the top. The final row need not be at the top of the grid. The lines should be aligned to the left side.","To make the output, you have to...rearrange the lines from smallest at the bottom of the grid to largest at the top. The final row should be at the top of the grid. The lines should be aligned to the right side.","To make the output, you have to...rearrange the lines from largest at the bottom of the grid to smallest at the top. The final row should be at the top of the grid. The lines should be aligned to the left side.","To make the output, you have to...rearrange the lines from smallest at the bottom of the grid to largest at the top. The final row need not be at the top of the grid. The lines should be aligned to the right side.","To make the output, you have to...rearrange the lines from largest at the bottom of the grid to smallest at the top. The final row need not be at the top of the grid. The lines should be aligned to the right side.",5
301,c0f76784,"To make the output, you have to...fill the center of the smallest square with brown, the middle square with gray color and the biggest square with green.","To make the output, you have to...fill the center of the smallest square with pink, the middle square with orange color and the biggest square with light blue.","To make the output, you have to...fill the center of the smallest rectangle with pink, the middle rectangle with orange color and the biggest rectangle with light blue.","To make the output, you have to...fill the center of the smallest square with green, the middle square with brown color and the biggest square with gray.","To make the output, you have to...fill the center of the biggest square with pink, the middle square with orange color and the smallest square with light blue.",2
302,c1d99e64,"To make the output, you have to...color the black squares that create a diagonal line all the way across the grid red and only those squares red.","To make the output, you have to...color the black squares that create a line vertical or horizontal all the way across the grid blue and only those squares blue.","To make the output, you have to...color the black squares that create a line vertical and horizontal all the way in the middle of the grid red and only those squares red.","To make the output, you have to...color the black rectangles that don't create a line vertical or horizontal all the way across the grid red and only those rectangles red.","To make the output, you have to...color the black squares that create a line vertical or horizontal all the way across the grid red and only those squares red.",5
303,c3e719e8,"To make the output, you have to...notice that you can copy the original 3x3 grid 9 times into the new grid (nine 3x3 patterns) and fill out the new grid in this pattern. Now look at which color is the most common in the input grid and keep that in mind. For example, if blue is the most common color in the input box and the top, left box is blue then copy the entire 3x3 box into the top, left 3x3 area in the new grid. If the bottom, middle box is blue then copy the entire 3x3 grid into the middle top of the new grid. Alternatively, suppose the top right box is red (or any other color that is not the most common) in the input grid...then that top right 3x3 area should be black in the new grid. Keep following that pattern until you're done. The black holes should now correlate to the locations of the colors of the boxes (in the input grid) that were not the most common.","To make the output, you have to...notice that you can copy the original 3x3 grid 9 times into the new grid (nine 3x3 patterns) and fill out the new grid in this pattern. Now look at which color is the most popular in the input grid and keep that in mind. For example, if black is the most common color in the input box and the middle box is black then copy the entire 3x3 box into the middle 3x3 area in the new grid. If the top, left box is grey then copy the entire 3x3 grid into the middle top of the new grid. Despite this, suppose the middle box is yellow (or any other color that is not the most common) in the input grid...then that middle 3x3 area should be white in the new grid. Keep neglecting that pattern until you're done. The white spaces should now correlate to the locations of the colors of the boxes (in the input grid) that were the most common.","To make the output, you have to...notice that you can duplicate the original 2x2 grid 4 times into the new grid and fill out the new grid in this pattern. Now inspect which color is the most uncommon in the input grid and remember that. For example, if red is the least common color in the input box and the bottom, right box is red then copy the entire 2x2 box into the bottom, right 2x2 area in the new grid. If the top, left box is blue then copy the entire 2x2 grid into the top left of the new grid. Conversely, suppose the top left box is yellow (or any other color that is not the least common) in the input grid...then that top left 2x2 area should be black in the new grid. Keep following that pattern until you're done. The black holes should now correlate to the locations of the colors of the boxes (in the input grid) that were not the least common.","To make the output, you have to...observe that you can clone the original 4x4 grid 7 times into the new grid (seven 4x4 patterns) and fill out the new grid in this pattern. Now look at which color is the least frequent in the input grid and keep that in mind. For example, if pink is the most rare color in the input box and the middle box is pink then copy the entire 4x4 box into the middle 4x4 area in the new grid. If the bottom, middle box is green then copy the entire 4x4 grid into the bottom middle of the new grid. Alternatively, suppose the top right box is grey (or any other color that is not the most rare) in the input grid...then that top right 4x4 area should be black in the new grid. Keep abiding by that pattern until you're done. The black holes should now correlate to the locations of the colors of the boxes (in the input grid) that were not the most rare.","To make the output, you have to...recognize that you can't copy the original 3x3 grid 9 times into the new grid (nine 3x3 patterns) and fill out the new grid in this pattern. Now look at which color is the least common in the input grid and ignore that. For example, if blue is the least common color in the input box and the top, left box is blue then avoid the entire 3x3 box into the top, left 3x3 area in the new grid. Suppose the top right box is red (or any other color that is the most common) in the input grid...then that top right 3x3 area should be white in the new grid. Continue ignoring that pattern until you're done. The colored holes should now correlate to the locations of the colors of the boxes (in the input grid) that were the most common.",1
304,c3f564a4,"To make the output, you have to...fill in black tiles with the same tile pattern in the vertical lines.","To make the output, you have to...fill in black tiles with the same tile pattern in the horizontal lines.","To make the output, you have to...fill in gray tiles with the same tile pattern in the diagonal lines.","To make the output, you have to...fill in black tiles with different tile pattern in the diagonal lines.","To make the output, you have to...fill in black tiles with the same tile pattern in the diagonal lines.",5
305,c444b776,"To make the output, you have to...replace the color in one section with any other section.","To make the output, you have to...move the color in one section to any other section.","To make the output, you have to...transfer the color in one section to any other section.","To make the output, you have to...remove the color in one section from any other section.","To make the output, you have to...copy the color in one section to any other section.",5
306,c59eb873,"To make the output, you have to...split each block into a 2x2 square in the different color as the original block. So, each block from the original input grid will become a 2x2 block of 4 squares of a different color from the original block.","To make the output, you have to...split each block into a 3x3 square in the same color as the original block. So, each block from the original input grid will become a 3x3 block of 4 squares of the same color as the original block.","To make the output, you have to...divide each block into a 4x4 square in the same color as the original block. So, each block from the original input grid will become a 4x4 block of 4 squares of the same color as the original block.","To make the output, you have to...divide each block into a 2x2 square in a randomly selected color. So, each block from the original input grid will become a 2x2 block of 4 squares of random color.","To make the output, you have to...divide each block into a 2x2 square in the same color as the original block. So, each block from the original input grid will become a 2x2 block of 4 squares of the same color as the original block.",5
307,c8cbb738,"To make the output, you have to...put none of the sets of pixels on top of each other keeping all colors the similar. Leave any left over blocks the color of the original backdrop.","To make the output, you have to...place all the groups of pixels beside each other keeping all colors different. Leave any left over blocks the color of the new object.","To make the output, you have to...place all the groups of pixels on top of each other keeping all colors the same. Leave any left over blocks the color of the original background.","To make the output, you have to...place all parts of the pixels on underneath of each other keeping all colors the same. Leave any left over blocks the color of the fresh background.","To make the output, you have to...place some of the groups of pixels on the bottom of each other changing all colors. Leave any left over blocks the color of the original background.",3
308,c8f0f002,"To make the output, you have to...change the red pixels into grey one.","To make the output, you have to...change the orange pixels into grey one.","To make the output, you have to...change the black pixels into grey one.","To make the output, you have to...change the orange pixels into black one.","To make the output, you have to...change the grey pixels into orange one.",2
309,c909285e,"To make the output, you have to...count the number of squares in the grey border and resize the output to that number. Then you color all the stars to match the input.","To make the output, you have to...count the number of squares in the colored border and resize the output to that number. Then you color all the blocks to match the input.","To make the output, you have to...count the number of circles in the colored border and resize the output to that number. Then you color all the blocks to match the input.","To make the output, you have to...measure the length of squares in the colored border and resize the output to that number. Then you draw all the squares to match the input.","To make the output, you have to...count the number of spheres in the colored border and resize the output to that number. Then you sketch all the shapes to match the input.",2
310,c9e6f938,"To make the output, you have to...make the pattern mirror as top-bottom with double the height and the same row.","To make the output, you have to...make the pattern mirror as top-bottom with the same height and twice the row.","To make the output, you have to...make the pattern mirror as left-right with the same height and twice the row.","To make the output, you have to...make the pattern mirror as left-right with the same height and half the row.","To make the output, you have to...make the pattern mirror as left-right with half the height and twice the row.",3
311,c9f8e694,"To make the output, you have to...color the horizontal rectangles in the same pattern as the vertical colors.","To make the output, you have to...color the horizontal blocks in the same pattern as the circular colors.","To make the output, you have to...color the vertical rectangles in the same pattern as the horizontal colors. ","To make the output, you have to...color the diagonal blocks in the same pattern as the vertical colors.","To make the output, you have to...color the horizontal blocks the same pattern as the vertical colors.",5
312,caa06a1f,"To make the output, you have to...duplicate the entire grid, then fill in the hollow color to exactly oppose the checker pattern. Finally result should be plain patterned.","To make the output, you have to...remove the entire grid, then fill in the solid color to exactly match the checker pattern. Finally result should be checker patterned.","To make the output, you have to...duplicate the entire grid, then emptiness to exactly match the checker pattern. Finally result should be checker patterned.","To make the output, you have to...duplicate the entire grid, then fill in the solid color to mismatch the checker pattern. Finally result should not be checker patterned.","To make the output, you have to...duplicate the entire grid, then fill in the solid color to exactly match the checker pattern. Finally result should be entirely checker patterned.",5
313,cbded52d,"To make the output, you have to...make each across and down row identical, matching the first block in each row to the end blocks.","To make the output, you have to...randomly distribute colors on the grid, irrespective of the middle block or end blocks in each row.","To make the output, you have to...make each vertical and horizontal row identical, altering the middle block in each row to the end blocks.","To make the output, you have to...make each across and down row different, matching the middle block in each row to the end blocks.","To make the output, you have to...make each across and down row identical, matching the middle block in each row to the end blocks.",5
314,cce03e0d,"To make the output, you have to...visualize the output grid as eight 4x4 blocks. The red squares on your input indicate which 'blocks' in your 8x8 grid you should work in. Copy the 4x4 input pattern to the 'blocks' indicated by the location of the red squares.","To make the output, you have to...visualize the output grid as ten 2x2 blocks. The red squares on your input indicate which 'blocks' in your 10x10 grid you should work in. Copy the 3x3 input pattern to the 'blocks' indicated by the location of the red squares.","To make the output, you have to...visualize the output grid as twelve 4x4 blocks. The red squares on your input indicate which 'blocks' in your 8x8 grid you should work in. Copy the 3x3 input pattern to the 'blocks' indicated by the location of the blue squares.","To make the output, you have to...visualize the output grid as nine 3x3 blocks. The green squares on your input indicate which 'blocks' in your 9x9 grid you should work in. Copy the 3x3 input pattern to the 'blocks' indicated by the location of the green squares.","To make the output, you have to...visualize the output grid as nine 3x3 blocks. The red squares on your input indicate which 'blocks' in your 9x9 grid you should work in. Copy the 3x3 input pattern to the 'blocks' indicated by the location of the red squares.",5
315,cdecee7f,"To make the output, you have to...follow the input grid colored squares from left to right. The left most color will be in the top left. The next colored square will to to the right. Each colored square will get its own square in the output. Continue this until you reach the top right corner of the output grid size. Then the next colored square will go under the top right and then they will fill in output grid to the left until it reaches the left edge. Then the it will go below that and continue to the right again. Do this until all of the colored squares from the input grid are used. The remaining squares in the output grid will be black.","To make the output, you have to...follow the input grid colored squares from top to bottom. The top most color will be in the top right. The next colored square will go below. Each colored square will get its own square in the output. Continue this until you reach the bottom right corner of the output grid size. Then the next colored square will go under the top right and then they will fill in output grid to the right until it reaches the right edge. Then the it will go below that and continue to the left again. Do this until all of the colored squares from the input grid are used. The remaining squares in the output grid will be yellow.","To make the output, you have to...follow the input grid colored squares from right to left. The right most color will be in the top left. The next colored square will be to the right. Each colored square will get its own square in the output. Continue this until you reach the top right corner of the output grid size. Then the next colored square will go under the top right and then they will fill in output grid to the left until it reaches the left edge. Then the it will go below that and continue to the right again. Do this until all of the colored squares from the input grid are used. The remaining squares in the output grid will be red.","To make the output, you have to...follow the input grid colored squares from left to right. The left most color will be in the bottom right. The next colored square will go to the left. Each colored square will get its own square in the output. Continue this until you reach the top left corner of the output grid size. Then the next colored square will go under the top right and then they will fill in output grid to the left until it reaches the left edge. Then the it will go below that and continue to the right again. Do this until all of the colored squares from the input grid are used. The remaining squares in the output grid will be blue.","To make the output, you have to...follow the input grid colored squares from top to bottom. The top most color will be in the top left. The next colored square will to be below. Each colored square will get its own square in the output. Continue this until you reach the bottom left corner of the output grid size. Then the next colored square will go under the top right and then they will fill in output grid to the right until it reaches the right edge. Then it will go below that and continue to the left again. Do this until all of the colored squares from the input grid are used. The remaining squares in the output grid will be green.",1
